{
  "format": "btp-art-v1",
  "schema_version": 1,
  "images": [
    {
      "id": "relay-contract:image-1",
      "name": "East Single",
      "kind": "tile",
      "width": 16,
      "height": 16,
      "frames": [
        [
          "83979dff83979dff83979dff83979dff83979dff83979dff83979dff83979dff83979dff83979dff83979dff83979dff83979dff83979dff83979dff83979dff",
          "83979dff83979dff83979dff83979dff83979dff83979dff83979dff83979dff83979dff83979dff83979dff83979dff83979dff83979dff83979dff83979dff",
          "83979dff83979dff83979dff83979dff83979dff83979dff83979dff83979dff83979dff83979dff83979dff83979dff83979dff83979dff83979dff83979dff",
          "43576aff43576aff43576aff43576aff43576aff43576aff43576aff43576aff43576aff43576aff43576aff43576aff43576aff43576aff43576aff43576aff",
          "43576aff43576aff43576aff6e96a3ff6e96a3ff6e96a3ff43576aff43576aff43576aff43576aff6e96a3ff6e96a3ff6e96a3ff43576aff43576aff43576aff",
          "43576aff43576aff43576aff6e96a3ff6e96a3ff6e96a3ff43576aff43576aff43576aff43576aff6e96a3ff6e96a3ff6e96a3ff43576aff43576aff43576aff",
          "43576aff43576aff43576aff6e96a3ff6e96a3ff6e96a3ff43576aff43576aff43576aff43576aff6e96a3ff6e96a3ff6e96a3ff43576aff43576aff43576aff",
          "43576aff43576aff43576aff6e96a3ff6e96a3ff6e96a3ff43576aff43576aff43576aff43576aff6e96a3ff6e96a3ff6e96a3ff43576aff43576aff43576aff",
          "43576aff43576aff43576aff6e96a3ff6e96a3ff6e96a3ff43576aff43576aff43576aff43576aff6e96a3ff6e96a3ff6e96a3ff43576aff43576aff43576aff",
          "43576aff43576aff43576aff6e96a3ff6e96a3ff6e96a3ff43576aff43576aff43576aff43576aff6e96a3ff6e96a3ff6e96a3ff43576aff43576aff43576aff",
          "43576aff43576aff43576aff6e96a3ff6e96a3ff6e96a3ff43576aff43576aff43576aff43576aff6e96a3ff6e96a3ff6e96a3ff43576aff43576aff43576aff",
          "43576aff43576aff43576aff43576aff43576aff43576aff43576aff43576aff43576aff43576aff43576aff43576aff43576aff43576aff43576aff43576aff",
          "43576aff43576aff43576aff43576aff43576aff43576aff43576aff43576aff43576aff43576aff43576aff43576aff43576aff43576aff43576aff43576aff",
          "344b57ff344b57ff344b57ff344b57ff344b57ff344b57ff344b57ff344b57ff344b57ff344b57ff344b57ff344b57ff344b57ff344b57ff344b57ff344b57ff",
          "344b57ff344b57ff344b57ff344b57ff344b57ff344b57ff344b57ff344b57ff344b57ff344b57ff344b57ff344b57ff344b57ff344b57ff344b57ff344b57ff",
          "344b57ff344b57ff344b57ff344b57ff344b57ff344b57ff344b57ff344b57ff344b57ff344b57ff344b57ff344b57ff344b57ff344b57ff344b57ff344b57ff"
        ]
      ]
    },
    {
      "id": "relay-contract:image-2",
      "name": "Empty",
      "kind": "tile",
      "width": 16,
      "height": 16,
      "frames": [
        [
          "48644aff48644aff48644aff48644aff48644aff48644aff48644aff48644aff48644aff48644aff48644aff48644aff48644aff48644aff48644aff48644aff",
          "48644aff48644aff48644aff48644aff48644aff48644aff48644aff48644aff48644aff48644aff48644aff48644aff48644aff48644aff48644aff48644aff",
          "48644aff48644aff48644aff48644aff48644aff48644aff48644aff48644aff48644aff48644aff48644aff48644aff48644aff48644aff48644aff48644aff",
          "48644aff48644aff48644aff48644aff48644aff48644aff48644aff48644aff48644aff48644aff48644aff48644aff48644aff48644aff48644aff48644aff",
          "48644aff48644aff48644aff48644aff48644aff48644aff48644aff48644aff48644aff48644aff48644aff48644aff48644aff48644aff48644aff48644aff",
          "48644aff48644aff48644aff48644aff48644aff48644aff48644aff48644aff48644aff48644aff48644aff48644aff48644aff48644aff48644aff48644aff",
          "48644aff48644aff48644aff48644aff48644aff48644aff48644aff48644aff48644aff48644aff48644aff48644aff48644aff48644aff48644aff48644aff",
          "48644aff48644aff48644aff48644aff48644aff48644aff48644aff48644aff48644aff48644aff48644aff48644aff48644aff48644aff48644aff48644aff",
          "48644aff48644aff48644aff48644aff48644aff48644aff48644aff48644aff48644aff48644aff48644aff48644aff48644aff48644aff48644aff48644aff",
          "48644aff48644aff48644aff48644aff48644aff48644aff48644aff48644aff48644aff48644aff48644aff48644aff48644aff48644aff48644aff48644aff",
          "48644aff48644aff48644aff48644aff48644aff48644aff48644aff48644aff48644aff48644aff48644aff48644aff48644aff48644aff48644aff48644aff",
          "48644aff48644aff48644aff48644aff48644aff48644aff48644aff48644aff48644aff48644aff48644aff48644aff48644aff48644aff48644aff48644aff",
          "48644aff48644aff48644aff48644aff48644aff48644aff48644aff48644aff48644aff48644aff48644aff48644aff48644aff48644aff48644aff48644aff",
          "48644aff48644aff48644aff48644aff48644aff48644aff48644aff48644aff48644aff48644aff48644aff48644aff48644aff48644aff48644aff48644aff",
          "48644aff48644aff48644aff48644aff48644aff48644aff48644aff48644aff48644aff48644aff48644aff48644aff48644aff48644aff48644aff48644aff",
          "48644aff48644aff48644aff48644aff48644aff48644aff48644aff48644aff48644aff48644aff48644aff48644aff48644aff48644aff48644aff48644aff"
        ]
      ]
    },
    {
      "id": "relay-contract:image-3",
      "name": "Roof centre",
      "kind": "tile",
      "width": 16,
      "height": 16,
      "frames": [
        [
          "99a7adff99a7adff99a7adff99a7adff99a7adff99a7adff99a7adff99a7adff99a7adff99a7adff99a7adff99a7adff99a7adff99a7adff99a7adff99a7adff",
          "99a7adffacb9bdffacb9bdffacb9bdffacb9bdffacb9bdffacb9bdffacb9bdff99a7adffacb9bdffacb9bdffacb9bdffacb9bdffacb9bdffacb9bdffacb9bdff",
          "99a7adffacb9bdffacb9bdffacb9bdffacb9bdffacb9bdffacb9bdffacb9bdff99a7adffacb9bdffacb9bdffacb9bdffacb9bdffacb9bdffacb9bdffacb9bdff",
          "99a7adffacb9bdffacb9bdffacb9bdffacb9bdffacb9bdffacb9bdffacb9bdff99a7adffacb9bdffacb9bdffacb9bdffacb9bdffacb9bdffacb9bdffacb9bdff",
          "99a7adffacb9bdffacb9bdffacb9bdffacb9bdffacb9bdffacb9bdffacb9bdff99a7adffacb9bdffacb9bdffacb9bdffacb9bdffacb9bdffacb9bdffacb9bdff",
          "99a7adffacb9bdffacb9bdffacb9bdffacb9bdffacb9bdffacb9bdffacb9bdff99a7adffacb9bdffacb9bdffacb9bdffacb9bdffacb9bdffacb9bdffacb9bdff",
          "99a7adffacb9bdffacb9bdffacb9bdffacb9bdffacb9bdffacb9bdffacb9bdff99a7adffacb9bdffacb9bdffacb9bdffacb9bdffacb9bdffacb9bdffacb9bdff",
          "99a7adffacb9bdffacb9bdffacb9bdffacb9bdffacb9bdffacb9bdffacb9bdff99a7adffacb9bdffacb9bdffacb9bdffacb9bdffacb9bdffacb9bdffacb9bdff",
          "99a7adff99a7adff99a7adff99a7adff99a7adff99a7adff99a7adff99a7adff99a7adff99a7adff99a7adff99a7adff99a7adff99a7adff99a7adff99a7adff",
          "99a7adffacb9bdffacb9bdffacb9bdffacb9bdffacb9bdffacb9bdffacb9bdff99a7adffacb9bdffacb9bdffacb9bdffacb9bdffacb9bdffacb9bdffacb9bdff",
          "99a7adffacb9bdffacb9bdffacb9bdffacb9bdffacb9bdffacb9bdffacb9bdff99a7adffacb9bdffacb9bdffacb9bdffacb9bdffacb9bdffacb9bdffacb9bdff",
          "99a7adffacb9bdffacb9bdffacb9bdffacb9bdffacb9bdffacb9bdffacb9bdff99a7adffacb9bdffacb9bdffacb9bdffacb9bdffacb9bdffacb9bdffacb9bdff",
          "99a7adffacb9bdffacb9bdffacb9bdffacb9bdffacb9bdffacb9bdffacb9bdff99a7adffacb9bdffacb9bdffacb9bdffacb9bdffacb9bdffacb9bdffacb9bdff",
          "99a7adffacb9bdffacb9bdffacb9bdffacb9bdffacb9bdffacb9bdffacb9bdff99a7adffacb9bdffacb9bdffacb9bdffacb9bdffacb9bdffacb9bdffacb9bdff",
          "99a7adffacb9bdffacb9bdffacb9bdffacb9bdffacb9bdffacb9bdffacb9bdff99a7adffacb9bdffacb9bdffacb9bdffacb9bdffacb9bdffacb9bdffacb9bdff",
          "99a7adffacb9bdffacb9bdffacb9bdffacb9bdffacb9bdffacb9bdffacb9bdff99a7adffacb9bdffacb9bdffacb9bdffacb9bdffacb9bdffacb9bdffacb9bdff"
        ]
      ]
    },
    {
      "id": "relay-contract:image-4",
      "name": "Roof S W edge",
      "kind": "tile",
      "width": 16,
      "height": 16,
      "frames": [
        [
          "d9e4e5ffd9e4e5ff99a7adff99a7adff99a7adff99a7adff99a7adff99a7adff99a7adff99a7adff99a7adff99a7adff99a7adff99a7adff99a7adff99a7adff",
          "d9e4e5ffd9e4e5ffacb9bdffacb9bdffacb9bdffacb9bdffacb9bdffacb9bdff99a7adffacb9bdffacb9bdffacb9bdffacb9bdffacb9bdffacb9bdffacb9bdff",
          "d9e4e5ffd9e4e5ffacb9bdffacb9bdffacb9bdffacb9bdffacb9bdffacb9bdff99a7adffacb9bdffacb9bdffacb9bdffacb9bdffacb9bdffacb9bdffacb9bdff",
          "d9e4e5ffd9e4e5ffacb9bdffacb9bdffacb9bdffacb9bdffacb9bdffacb9bdff99a7adffacb9bdffacb9bdffacb9bdffacb9bdffacb9bdffacb9bdffacb9bdff",
          "d9e4e5ffd9e4e5ffacb9bdffacb9bdffacb9bdffacb9bdffacb9bdffacb9bdff99a7adffacb9bdffacb9bdffacb9bdffacb9bdffacb9bdffacb9bdffacb9bdff",
          "d9e4e5ffd9e4e5ffacb9bdffacb9bdffacb9bdffacb9bdffacb9bdffacb9bdff99a7adffacb9bdffacb9bdffacb9bdffacb9bdffacb9bdffacb9bdffacb9bdff",
          "d9e4e5ffd9e4e5ffacb9bdffacb9bdffacb9bdffacb9bdffacb9bdffacb9bdff99a7adffacb9bdffacb9bdffacb9bdffacb9bdffacb9bdffacb9bdffacb9bdff",
          "d9e4e5ffd9e4e5ffacb9bdffacb9bdffacb9bdffacb9bdffacb9bdffacb9bdff99a7adffacb9bdffacb9bdffacb9bdffacb9bdffacb9bdffacb9bdffacb9bdff",
          "d9e4e5ffd9e4e5ff99a7adff99a7adff99a7adff99a7adff99a7adff99a7adff99a7adff99a7adff99a7adff99a7adff99a7adff99a7adff99a7adff99a7adff",
          "d9e4e5ffd9e4e5ffacb9bdffacb9bdffacb9bdffacb9bdffacb9bdffacb9bdff99a7adffacb9bdffacb9bdffacb9bdffacb9bdffacb9bdffacb9bdffacb9bdff",
          "d9e4e5ffd9e4e5ffacb9bdffacb9bdffacb9bdffacb9bdffacb9bdffacb9bdff99a7adffacb9bdffacb9bdffacb9bdffacb9bdffacb9bdffacb9bdffacb9bdff",
          "d9e4e5ffd9e4e5ffacb9bdffacb9bdffacb9bdffacb9bdffacb9bdffacb9bdff99a7adffacb9bdffacb9bdffacb9bdffacb9bdffacb9bdffacb9bdffacb9bdff",
          "d9e4e5ffd9e4e5ffacb9bdffacb9bdffacb9bdffacb9bdffacb9bdffacb9bdff99a7adffacb9bdffacb9bdffacb9bdffacb9bdffacb9bdffacb9bdffacb9bdff",
          "d9e4e5ffd9e4e5ffacb9bdffacb9bdffacb9bdffacb9bdffacb9bdffacb9bdff99a7adffacb9bdffacb9bdffacb9bdffacb9bdffacb9bdffacb9bdffacb9bdff",
          "586c79ff586c79ff586c79ff586c79ff586c79ff586c79ff586c79ff586c79ff586c79ff586c79ff586c79ff586c79ff586c79ff586c79ff586c79ff586c79ff",
          "586c79ff586c79ff586c79ff586c79ff586c79ff586c79ff586c79ff586c79ff586c79ff586c79ff586c79ff586c79ff586c79ff586c79ff586c79ff586c79ff"
        ]
      ]
    },
    {
      "id": "relay-contract:image-5",
      "name": "Roof N edge",
      "kind": "tile",